{
  "schema_version": 1,
  "mapping_version": "draft-3-review-dispositions",
  "authority": "app.canonical_problem_families.FAMILIES[*].canonical_skill_code",
  "release_status": "DRAFT_NOT_FOR_RUNTIME",
  "aliases": [
    {
      "alias": "MATH.ELEMENTARY.ARITHMETIC.ADD_SUB_WITHIN_100",
      "status": "UNMAPPED",
      "relation": null,
      "target_skill_codes": [],
      "evidence": [],
      "reviewed_by": null
    },
    {
      "alias": "MATH.ELEMENTARY.ARITHMETIC.ADD_SUB_WITHIN_20",
      "status": "UNMAPPED",
      "relation": null,
      "target_skill_codes": [],
      "evidence": [
        "NEEDS_SPLIT (independent math review 2026-10-10, issue #293): pack-local addition and subtraction skills share this alias; an ALL_OF pair would falsely require both operations. Split local mappings to bounded addition and bounded subtraction identities; a combined result may exist only as a reporting profile with separate evidence and no mastery row. Rejected target set removed; fail closed."
      ],
      "reviewed_by": null
    },
    {
      "alias": "MATH.ELEMENTARY.ARITHMETIC.EQUATION_BALANCE",
      "status": "UNMAPPED",
      "relation": null,
      "target_skill_codes": [],
      "evidence": [
        "UNMAPPED confirmed (independent math review 2026-10-10, issue #293): missing-addend arithmetic is only part of the skill; equality as a symmetric relation, true/false equations and varied unknown positions are uncovered by approved r5 identities. Do not substitute the older-grade one-step-equation identity. Fail closed."
      ],
      "reviewed_by": null
    },
    {
      "alias": "MATH.ELEMENTARY.ARITHMETIC.LONG_DIVISION",
      "status": "UNMAPPED",
      "relation": null,
      "target_skill_codes": [],
      "evidence": [],
      "reviewed_by": null
    },
    {
      "alias": "MATH.ELEMENTARY.ARITHMETIC.MULTI_DIGIT_MULTIPLICATION",
      "status": "UNMAPPED",
      "relation": null,
      "target_skill_codes": [],
      "evidence": [],
      "reviewed_by": null
    },
    {
      "alias": "MATH.ELEMENTARY.ARITHMETIC.MULTI_STEP_WORD_PROBLEMS",
      "status": "UNMAPPED",
      "relation": null,
      "target_skill_codes": [],
      "evidence": [],
      "reviewed_by": null
    },
    {
      "alias": "MATH.ELEMENTARY.ARITHMETIC.ORDER_OF_OPERATIONS",
      "status": "UNMAPPED",
      "relation": null,
      "target_skill_codes": [],
      "evidence": [],
      "reviewed_by": null
    },
    {
      "alias": "MATH.ELEMENTARY.ARITHMETIC.WORD_PROBLEM_WITHIN_100",
      "status": "UNMAPPED",
      "relation": null,
      "target_skill_codes": [],
      "evidence": [],
      "reviewed_by": null
    },
    {
      "alias": "MATH.ELEMENTARY.ARITHMETIC.WORD_PROBLEM_WITHIN_20",
      "status": "UNMAPPED",
      "relation": null,
      "target_skill_codes": [],
      "evidence": [
        "REJECTED target set (independent math review 2026-10-10, issue #293): ADDITION + SUBTRACTION do not establish contextual modeling, unknown-role coverage, comparison semantics or answer interpretation. Await bounded word-problem candidate after taxonomy authority activation; current pack evidence is mostly result-unknown with incorrect stored answers. Fail closed."
      ],
      "reviewed_by": null
    },
    {
      "alias": "MATH.ELEMENTARY.DATA.PICTURE_BAR_GRAPHS",
      "status": "UNMAPPED",
      "relation": null,
      "target_skill_codes": [],
      "evidence": [],
      "reviewed_by": null
    },
    {
      "alias": "MATH.ELEMENTARY.DECIMALS.PLACE_VALUE_OPERATIONS",
      "status": "UNMAPPED",
      "relation": null,
      "target_skill_codes": [],
      "evidence": [],
      "reviewed_by": null
    },
    {
      "alias": "MATH.ELEMENTARY.DIVISION.EQUAL_SHARING",
      "status": "UNMAPPED",
      "relation": null,
      "target_skill_codes": [],
      "evidence": [],
      "reviewed_by": null
    },
    {
      "alias": "MATH.ELEMENTARY.FRACTIONS.ADD_SUBTRACT_UNLIKE",
      "status": "UNMAPPED",
      "relation": null,
      "target_skill_codes": [],
      "evidence": [],
      "reviewed_by": null
    },
    {
      "alias": "MATH.ELEMENTARY.FRACTIONS.DECIMAL_NOTATION",
      "status": "UNMAPPED",
      "relation": null,
      "target_skill_codes": [],
      "evidence": [],
      "reviewed_by": null
    },
    {
      "alias": "MATH.ELEMENTARY.FRACTIONS.EQUIVALENCE_OPERATIONS",
      "status": "UNMAPPED",
      "relation": null,
      "target_skill_codes": [],
      "evidence": [],
      "reviewed_by": null
    },
    {
      "alias": "MATH.ELEMENTARY.FRACTIONS.FRACTIONS_AS_NUMBERS",
      "status": "UNMAPPED",
      "relation": null,
      "target_skill_codes": [],
      "evidence": [],
      "reviewed_by": null
    },
    {
      "alias": "MATH.ELEMENTARY.FRACTIONS.MULTIPLY_DIVIDE",
      "status": "UNMAPPED",
      "relation": null,
      "target_skill_codes": [],
      "evidence": [],
      "reviewed_by": null
    },
    {
      "alias": "MATH.ELEMENTARY.GEOMETRY.ANGLES_LINES_SHAPES",
      "status": "UNMAPPED",
      "relation": null,
      "target_skill_codes": [],
      "evidence": [],
      "reviewed_by": null
    },
    {
      "alias": "MATH.ELEMENTARY.GEOMETRY.CLASSIFY_2D_FIGURES",
      "status": "UNMAPPED",
      "relation": null,
      "target_skill_codes": [],
      "evidence": [],
      "reviewed_by": null
    },
    {
      "alias": "MATH.ELEMENTARY.GEOMETRY.COORDINATE_PLANE",
      "status": "UNMAPPED",
      "relation": null,
      "target_skill_codes": [],
      "evidence": [],
      "reviewed_by": null
    },
    {
      "alias": "MATH.ELEMENTARY.GEOMETRY.IDENTIFY_COMPOSE_SHAPES",
      "status": "UNMAPPED",
      "relation": null,
      "target_skill_codes": [],
      "evidence": [
        "UNMAPPED confirmed (independent math review 2026-10-10, issue #293): counting sides or later-grade quadrilateral classification is not equivalent to defining/non-defining attributes, constructing/drawing, or composing shapes. Requires a distinct reviewed identity. Fail closed."
      ],
      "reviewed_by": null
    },
    {
      "alias": "MATH.ELEMENTARY.GEOMETRY.QUADRILATERAL_ATTRIBUTES",
      "status": "UNMAPPED",
      "relation": null,
      "target_skill_codes": [],
      "evidence": [],
      "reviewed_by": null
    },
    {
      "alias": "MATH.ELEMENTARY.GEOMETRY.SHAPES_EQUAL_SHARES",
      "status": "UNMAPPED",
      "relation": null,
      "target_skill_codes": [],
      "evidence": [],
      "reviewed_by": null
    },
    {
      "alias": "MATH.ELEMENTARY.MEASUREMENT.AREA_PERIMETER",
      "status": "UNMAPPED",
      "relation": null,
      "target_skill_codes": [],
      "evidence": [],
      "reviewed_by": null
    },
    {
      "alias": "MATH.ELEMENTARY.MEASUREMENT.CONVERSION",
      "status": "UNMAPPED",
      "relation": null,
      "target_skill_codes": [],
      "evidence": [],
      "reviewed_by": null
    },
    {
      "alias": "MATH.ELEMENTARY.MEASUREMENT.LENGTH_COMPARE",
      "status": "UNMAPPED",
      "relation": null,
      "target_skill_codes": [],
      "evidence": [],
      "reviewed_by": null
    },
    {
      "alias": "MATH.ELEMENTARY.MEASUREMENT.MONEY_COUNT",
      "status": "UNMAPPED",
      "relation": null,
      "target_skill_codes": [],
      "evidence": [],
      "reviewed_by": null
    },
    {
      "alias": "MATH.ELEMENTARY.MEASUREMENT.TELL_TIME_FIVE_MINUTES",
      "status": "UNMAPPED",
      "relation": null,
      "target_skill_codes": [],
      "evidence": [],
      "reviewed_by": null
    },
    {
      "alias": "MATH.ELEMENTARY.MEASUREMENT.TELL_TIME_HOUR_HALF_HOUR",
      "status": "UNMAPPED",
      "relation": null,
      "target_skill_codes": [],
      "evidence": [
        "UNMAPPED confirmed (independent math review 2026-10-10, issue #293): clock-face reading/writing at hour and half-hour is not equivalent to elapsed-time reasoning or unit conversion. Requires a distinct reviewed identity. Fail closed."
      ],
      "reviewed_by": null
    },
    {
      "alias": "MATH.ELEMENTARY.MEASUREMENT.TELL_TIME_MINUTE_ELAPSED",
      "status": "UNMAPPED",
      "relation": null,
      "target_skill_codes": [],
      "evidence": [],
      "reviewed_by": null
    },
    {
      "alias": "MATH.ELEMENTARY.MEASUREMENT.VOLUME",
      "status": "UNMAPPED",
      "relation": null,
      "target_skill_codes": [],
      "evidence": [],
      "reviewed_by": null
    },
    {
      "alias": "MATH.ELEMENTARY.MULTIPLICATION.EQUAL_GROUPS",
      "status": "UNMAPPED",
      "relation": null,
      "target_skill_codes": [],
      "evidence": [],
      "reviewed_by": null
    },
    {
      "alias": "MATH.ELEMENTARY.MULTIPLICATION.MULTIPLICATIVE_COMPARISON",
      "status": "UNMAPPED",
      "relation": null,
      "target_skill_codes": [],
      "evidence": [],
      "reviewed_by": null
    },
    {
      "alias": "MATH.ELEMENTARY.MULTIPLICATION.PROPERTIES_FACT_FAMILIES",
      "status": "UNMAPPED",
      "relation": null,
      "target_skill_codes": [],
      "evidence": [],
      "reviewed_by": null
    },
    {
      "alias": "MATH.ELEMENTARY.NUMBER_SENSE.COUNT_COMPARE_TO_120",
      "status": "UNMAPPED",
      "relation": null,
      "target_skill_codes": [],
      "evidence": [
        "NEEDS_SPLIT (independent math review 2026-10-10, issue #293): alias combines forward sequence production, numeral representation, pairwise comparison and ordering; approved r5 identities cover sequence continuation and pairwise comparison only. Broad MATH.NS.COUNTING + MATH.NS.COMPARE_ORDER are not range-equivalent and cannot transfer mastery. Rejected target set removed; fail closed with zero coverage credit."
      ],
      "reviewed_by": null
    },
    {
      "alias": "MATH.ELEMENTARY.NUMBER_SENSE.FACTORS_MULTIPLES_PATTERNS",
      "status": "UNMAPPED",
      "relation": null,
      "target_skill_codes": [],
      "evidence": [],
      "reviewed_by": null
    },
    {
      "alias": "MATH.ELEMENTARY.NUMBER_SENSE.PATTERNS_TWO_RULES",
      "status": "UNMAPPED",